{
  "$schema": "https://json-schema.org/draft/2020-12/schema",
  "$id": "https://euronext.example/infosec-foundry/golden-set.schema.json",
  "title": "InfoSec Assurance Foundry — evaluation golden set",
  "description": "Known-good cases per report type (a–f, d2) and advisory system (g/h/i) used by operations/evaluation/run_evals.py. Inputs are synthetic or public only; real supplier material stays on the SharePoint site under Governance/ComparisonSet/ and is referenced by relative path + sha256, never copied into the repository. Controls: ISO 42001 A.6.2.4 / A.8.4, ISO 27001:2022 A.8.29, EU AI Act Art. 9(6)–(8).",
  "type": "object",
  "required": ["version", "cases"],
  "additionalProperties": false,
  "properties": {
    "$schema": { "type": "string" },
    "version": { "type": "string", "pattern": "^[0-9]+\\.[0-9]+(\\.[0-9]+)?$" },
    "description": { "type": "string" },
    "owner": { "type": "string", "description": "Accountable owner placeholder, e.g. {upn:francisco.gomes}" },
    "reviewed": { "type": "string", "format": "date", "description": "Last quarterly review (CHANGE_MANAGEMENT.md §9)" },
    "inputs_root": { "type": "string", "description": "Site path that case input paths are relative to (default Governance/ComparisonSet/inputs/)" },
    "baseline_root": { "type": "string", "description": "Site path that baseline paths are relative to (default Governance/ComparisonSet/baseline/)" },
    "floors": { "$ref": "#/$defs/floors" },
    "cases": {
      "type": "array",
      "minItems": 1,
      "items": { "$ref": "#/$defs/case" }
    }
  },
  "$defs": {
    "floors": {
      "type": "object",
      "description": "Aggregate metric floors (fraction of evaluated cases, 0–1). Gate G1 fails when any metric is below its floor (EVALUATION.md §4). Per-case overrides live in case.floors.",
      "additionalProperties": false,
      "properties": {
        "verifier_first_pass": { "type": "number", "minimum": 0, "maximum": 1, "default": 1.0 },
        "structure_fidelity": { "type": "number", "minimum": 0, "maximum": 1, "default": 1.0 },
        "placeholder_free": { "type": "number", "minimum": 0, "maximum": 1, "default": 1.0 },
        "threshold_exactness": { "type": "number", "minimum": 0, "maximum": 1, "default": 1.0 },
        "grounding_rate": { "type": "number", "minimum": 0, "maximum": 1, "default": 0.9 },
        "citation_validity": { "type": "number", "minimum": 0, "maximum": 1, "default": 0.95 },
        "egress_clean": { "type": "number", "minimum": 0, "maximum": 1, "default": 1.0 },
        "budget_ok": { "type": "number", "minimum": 0, "maximum": 1, "default": 0.9 }
      }
    },
    "case": {
      "type": "object",
      "required": ["id", "requirement", "kind", "agent", "tier_of_record", "input", "checks"],
      "additionalProperties": false,
      "properties": {
        "id": { "type": "string", "pattern": "^[a-z0-9][a-z0-9-]{2,63}$" },
        "title": { "type": "string" },
        "requirement": { "type": "string", "enum": ["a", "b", "c", "d", "d2", "e", "f", "g", "h", "i", "j", "verifier"] },
        "kind": {
          "type": "string",
          "enum": ["report", "advisory", "routing", "verifier-negative"],
          "description": "report = pipeline deliverable checked to the verifier; advisory = in-thread answer (g/h); routing = orchestrator hand-off / read-only behaviour (i); verifier-negative = a defective draft that MUST fail"
        },
        "pipeline": {
          "type": "string",
          "enum": [
            "deepsearch-report", "ai-deepsearch-report", "dpia-dpo-report", "cyber-forum-pptx", "cyber-forum-brief",
            "ciso-global-pptx", "ciso-exec-summary", "tpa-evidence-analysis", "soc-report-summary",
            "pentest-report-summary", "advisory-file-delivery", "transcript-summary", "template-update-approval"
          ],
          "description": "Key in workflows/pipelines.json (or the template workflow); omitted for advisory/routing cases"
        },
        "agent": { "type": "string", "description": "Producing agent name as created by create_agents.py / create_delivery_agents.py / create_orchestrator.py" },
        "tier_of_record": { "type": "string", "enum": ["light", "chat", "reasoning"], "description": "model_tier in integrations/registry.json at the time the case was baselined" },
        "input": { "$ref": "#/$defs/input" },
        "expected_verdict": { "type": "string", "enum": ["PASS", "FAIL"], "default": "PASS", "description": "Expected output-verifier verdict (FAIL only for verifier-negative cases)" },
        "checks": { "$ref": "#/$defs/checks" },
        "budget": { "$ref": "#/$defs/budget" },
        "floors": { "$ref": "#/$defs/floors" },
        "fixture": {
          "type": "string",
          "description": "Short SYNTHETIC sample output used by --dry-run to exercise the deterministic checks offline (never a real deliverable)"
        },
        "fixture_verdict": { "type": "string", "enum": ["PASS", "FAIL"], "description": "Verifier verdict to assume for the fixture in --dry-run" },
        "tags": { "type": "array", "items": { "type": "string" } },
        "added": { "type": "string", "format": "date" },
        "author": { "type": "string", "description": "Placeholder UPN of the team member who authored the case" },
        "notes": { "type": "string" }
      }
    },
    "input": {
      "type": "object",
      "required": ["prompt"],
      "additionalProperties": false,
      "properties": {
        "prompt": { "type": "string", "minLength": 1, "description": "User message sent to the agent (pipeline cases: the same Supplier/Service framing the trigger would send)" },
        "supplierName": { "type": "string", "description": "Placeholder only, e.g. {supplier:example-corp}" },
        "serviceName": { "type": "string", "description": "Placeholder only, e.g. {service:managed-hosting}" },
        "files": {
          "type": "array",
          "items": {
            "type": "object",
            "required": ["path"],
            "additionalProperties": false,
            "properties": {
              "path": { "type": "string", "description": "Relative to inputs_root — synthetic/anonymised/public material only" },
              "sha256": { "type": "string", "pattern": "^[a-f0-9]{64}$" },
              "content_type": { "type": "string" },
              "attach_as": { "type": "string", "enum": ["code_interpreter", "file_search"], "default": "code_interpreter" }
            }
          }
        }
      }
    },
    "checks": {
      "type": "object",
      "additionalProperties": false,
      "properties": {
        "output_format": { "type": "string", "enum": ["html", "json", "text", "markdown", "verifier"], "default": "text", "description": "What the agent's draft text is parsed as before checks (docx/pptx/xlsx pipelines evaluate the agent's verified JSON draft; the rendered binary is covered by baseline sha256)" },
        "required_sections": { "type": "array", "items": { "type": "string" }, "description": "Case-insensitive substrings (or JSON keys when output_format=json) that must all be present — structure_fidelity" },
        "min_sections": { "type": "integer", "minimum": 0 },
        "must_contain": { "type": "array", "items": { "type": "string" } },
        "must_not_contain": { "type": "array", "items": { "type": "string" } },
        "forbidden_patterns": { "type": "array", "items": { "type": "string" }, "description": "Regexes; defaults to the verifier's placeholder rule ({{TOKEN}}, TBD, lorem, xxx) — placeholder_free" },
        "citation_pattern": { "type": "string", "description": "Regex a valid citation matches (e.g. Art\\.\\s?\\d+ or A\\.\\d+\\.\\d+) — grounding_rate / citation_validity" },
        "min_citations": { "type": "integer", "minimum": 0 },
        "allowed_citation_sources": { "type": "array", "items": { "type": "string" }, "description": "Every citation must name one of these frameworks/sources (substring match) — citation_validity" },
        "score_attribute": {
          "type": "object",
          "required": ["pattern"],
          "additionalProperties": false,
          "properties": {
            "pattern": { "type": "string", "description": "Regex with one numeric capture group, e.g. data-overall-score=\"(\\d+)\"" },
            "min": { "type": "number" },
            "max": { "type": "number" }
          },
          "description": "Score/threshold exactness against the known-good range — threshold_exactness"
        },
        "json_required_keys": { "type": "array", "items": { "type": "string" } },
        "baseline": {
          "type": "object",
          "required": ["path", "sha256"],
          "additionalProperties": false,
          "properties": {
            "path": { "type": "string", "description": "Relative to baseline_root" },
            "sha256": { "type": "string", "pattern": "^[a-f0-9]{64}$" },
            "deterministic": { "type": "boolean", "default": false, "description": "true = the output must hash-match (rendered files, light-tier transformations); false = informational diff only" }
          }
        },
        "internal_markers": { "type": "array", "items": { "type": "string" }, "description": "Strings that must never appear in the output (or, live, in any web-search query span) — egress_clean; defaults to the platform markers" },
        "expect_handoff_to": { "type": "string", "description": "routing cases: agent the orchestrator must hand off to (checked as a substring of the answer/trace)" },
        "expect_no_write_language": { "type": "boolean", "default": true, "description": "The draft must be framed as awaiting approval, never as submitted (verifier rule 7)" }
      }
    },
    "budget": {
      "type": "object",
      "additionalProperties": false,
      "properties": {
        "max_input_tokens": { "type": "integer", "minimum": 1 },
        "max_output_tokens": { "type": "integer", "minimum": 1 },
        "max_latency_s": { "type": "number", "minimum": 1 },
        "max_cost_eur": { "type": "number", "minimum": 0 }
      },
      "description": "Per-case token/latency/cost ceilings from FINOPS.md §2 — budget_ok"
    }
  }
}
