{
  "$schema": "./golden-set.schema.json",
  "version": "1.0",
  "description": "Starter golden set for the InfoSec Assurance Foundry platform — one case per report type (a–f, d2), the advisory systems (g/h), orchestrator routing and read-only behaviour (i) and a verifier-negative control. Every input is synthetic or public; fixtures are short synthetic samples for --dry-run only. Real comparison-set inputs and baselines live on the site under Governance/ComparisonSet/ (CHANGE_MANAGEMENT.md §4).",
  "owner": "{upn:francisco.gomes}",
  "reviewed": "2026-09-01",
  "inputs_root": "Governance/ComparisonSet/inputs/",
  "baseline_root": "Governance/ComparisonSet/baseline/",
  "floors": {
    "verifier_first_pass": 1.0,
    "structure_fidelity": 1.0,
    "placeholder_free": 1.0,
    "threshold_exactness": 1.0,
    "grounding_rate": 0.9,
    "citation_validity": 0.95,
    "egress_clean": 1.0,
    "budget_ok": 0.9
  },
  "cases": [
    {
      "id": "a-deepsearch-public-domain",
      "title": "DeepSearch HTML dashboard for a public supplier domain",
      "requirement": "a",
      "kind": "report",
      "pipeline": "deepsearch-report",
      "agent": "deepsearch-protocol",
      "tier_of_record": "reasoning",
      "input": {
        "prompt": "Assess Security of {supplier:example-corp} (public domain {domain:example.com}). Supplier: {supplier:example-corp}; Service: {service:managed-hosting}. Produce the complete DeepSearch V17.02.11 single-file HTML dashboard as a DRAFT awaiting approval.",
        "supplierName": "{supplier:example-corp}",
        "serviceName": "{service:managed-hosting}"
      },
      "checks": {
        "output_format": "html",
        "required_sections": ["Executive Summary", "Service Identification", "Corporate Metadata", "Security Posture", "Technical Infrastructure", "Vulnerability", "Incidents", "AI Governance", "Integrations", "Controls Validation", "Confidence"],
        "score_attribute": { "pattern": "data-overall-score=\"(\\d{1,3})\"", "min": 0, "max": 100 },
        "must_contain": ["awaiting"],
        "internal_markers": ["{marker:internal}", "ENX-INTERNAL", "{assessment-id}"]
      },
      "budget": { "max_input_tokens": 200000, "max_output_tokens": 90000, "max_latency_s": 600, "max_cost_eur": 0.9 },
      "fixture": "<html><body data-overall-score=\"72\"><h1>Executive Summary</h1><h2>Service Identification</h2><h2>Corporate Metadata</h2><h2>Security Posture</h2><h2>Technical Infrastructure</h2><h2>Vulnerability &amp; Threat Landscape</h2><h2>Incidents &amp; Exposure</h2><h2>AI Governance</h2><h2>Integrations</h2><h2>Controls Validation</h2><h2>Confidence Scoring</h2><p>DRAFT awaiting your approval.</p></body></html>",
      "fixture_verdict": "PASS",
      "tags": ["pipeline", "osint", "reasoning"],
      "added": "2026-09-01",
      "author": "{upn:jose.mogollon}"
    },
    {
      "id": "b-dpia-synthetic-onetrust-pdf",
      "title": "OneTrust PDF to InfoSec TPA report for the DPO (DOCX contract)",
      "requirement": "b",
      "kind": "report",
      "pipeline": "dpia-dpo-report",
      "agent": "dpia",
      "tier_of_record": "chat",
      "input": {
        "prompt": "Generate the InfoSec TPA Report for the DPO team from the attached OneTrust assessment. Supplier: {supplier:example-corp}; Service: {service:hr-payroll-saas}. Return the verified JSON draft for the DOCX renderer, awaiting approval.",
        "supplierName": "{supplier:example-corp}",
        "serviceName": "{service:hr-payroll-saas}",
        "files": [ { "path": "synthetic/onetrust-infosec-form-example.pdf", "content_type": "application/pdf", "attach_as": "code_interpreter" } ]
      },
      "checks": {
        "output_format": "json",
        "json_required_keys": ["supplier", "service", "risks", "controls", "implementation_status", "recommendation"],
        "must_contain": ["awaiting"],
        "baseline": { "path": "dpia-dpo-report/example-corp-hr-payroll.docx", "sha256": "0000000000000000000000000000000000000000000000000000000000000000", "deterministic": false }
      },
      "budget": { "max_input_tokens": 60000, "max_output_tokens": 12000, "max_latency_s": 240, "max_cost_eur": 0.4 },
      "fixture": "{\"supplier\": \"{supplier:example-corp}\", \"service\": \"{service:hr-payroll-saas}\", \"risks\": [{\"id\": \"R1\", \"severity\": \"Medium\"}], \"controls\": [{\"id\": \"C1\", \"status\": \"Implemented\"}], \"implementation_status\": \"Partially implemented\", \"recommendation\": \"Proceed with conditions\", \"status\": \"DRAFT awaiting approval\"}",
      "fixture_verdict": "PASS",
      "tags": ["pipeline", "docx", "chat"],
      "added": "2026-09-01",
      "author": "{upn:pedro.santos}"
    },
    {
      "id": "c-cyber-forum-deck",
      "title": "OneTrust PDF to Cyber Forum 8-slide deck (PPTX contract)",
      "requirement": "c",
      "kind": "report",
      "pipeline": "cyber-forum-pptx",
      "agent": "ciso-reporting",
      "tier_of_record": "chat",
      "input": {
        "prompt": "Produce the Group CISO Governance 8-slide deck JSON draft from the attached assessment. Supplier: {supplier:example-corp}; Service: {service:hr-payroll-saas}. Draft awaiting approval.",
        "supplierName": "{supplier:example-corp}",
        "serviceName": "{service:hr-payroll-saas}",
        "files": [ { "path": "synthetic/onetrust-infosec-form-example.pdf", "content_type": "application/pdf" } ]
      },
      "checks": {
        "output_format": "json",
        "json_required_keys": ["slides", "classification", "overall_score"],
        "score_attribute": { "pattern": "\"overall_score\":\\s*(\\d+(?:\\.\\d+)?)", "min": 0, "max": 10 },
        "must_contain": ["awaiting"]
      },
      "budget": { "max_input_tokens": 70000, "max_output_tokens": 10000, "max_latency_s": 240, "max_cost_eur": 0.4 },
      "fixture": "{\"slides\": [1,2,3,4,5,6,7,8], \"classification\": \"Medium\", \"overall_score\": 5.2, \"status\": \"DRAFT awaiting approval\"}",
      "fixture_verdict": "PASS",
      "tags": ["pipeline", "pptx", "chat"],
      "added": "2026-09-01",
      "author": "{upn:jose.meireles}"
    },
    {
      "id": "c-cyber-forum-brief",
      "title": "Threat-intelligence brief attached to the Cyber Forum deck",
      "requirement": "c",
      "kind": "report",
      "pipeline": "cyber-forum-brief",
      "agent": "cyber-forum",
      "tier_of_record": "reasoning",
      "input": {
        "prompt": "Write the Cyber Forum threat-intelligence brief for {supplier:example-corp} / {service:hr-payroll-saas}: current threats to payroll SaaS providers, regulatory expectations (DORA, NIS2) and recommended positions. Draft awaiting approval; cite articles.",
        "supplierName": "{supplier:example-corp}",
        "serviceName": "{service:hr-payroll-saas}"
      },
      "checks": {
        "output_format": "markdown",
        "required_sections": ["Threat landscape", "Regulatory", "Recommend"],
        "citation_pattern": "Art\\.\\s?\\d+",
        "min_citations": 2,
        "allowed_citation_sources": ["DORA", "NIS2", "GDPR", "EU AI Act"],
        "must_contain": ["awaiting"]
      },
      "budget": { "max_input_tokens": 50000, "max_output_tokens": 12000, "max_latency_s": 300, "max_cost_eur": 0.3 },
      "fixture": "# Threat landscape\nPayroll SaaS providers face credential-stuffing and supply-chain compromise.\n# Regulatory expectations\nDORA Art. 28 requires ICT third-party risk management; NIS2 Art. 21 lists supply-chain security measures.\n# Recommended positions\nRequire MFA and SBOM. DRAFT awaiting approval.",
      "fixture_verdict": "PASS",
      "tags": ["pipeline", "docx", "reasoning"],
      "added": "2026-09-01",
      "author": "{upn:tania.morais}"
    },
    {
      "id": "d-ciso-global-deck",
      "title": "OneTrust PDF to Global CISO 9-slide deck with CMDB grounding",
      "requirement": "d",
      "kind": "report",
      "pipeline": "ciso-global-pptx",
      "agent": "ciso-global-report",
      "tier_of_record": "reasoning",
      "input": {
        "prompt": "Produce the Global CISO 9-slide deck JSON draft for {supplier:example-corp} / {service:hr-payroll-saas} from the attached assessment; ground the contract owner and impacted ENX entities in the CMDB. Draft awaiting approval.",
        "supplierName": "{supplier:example-corp}",
        "serviceName": "{service:hr-payroll-saas}",
        "files": [ { "path": "synthetic/onetrust-infosec-form-example.pdf", "content_type": "application/pdf" } ]
      },
      "checks": {
        "output_format": "json",
        "json_required_keys": ["contract_owner", "impacted_entities", "service_description", "risk_controls_resume", "exposure", "inherent_score", "residual_score", "actions"],
        "score_attribute": { "pattern": "\"residual_score\":\\s*(\\d+(?:\\.\\d+)?)", "min": 0, "max": 10 },
        "must_contain": ["awaiting"]
      },
      "budget": { "max_input_tokens": 90000, "max_output_tokens": 25000, "max_latency_s": 360, "max_cost_eur": 0.4 },
      "fixture": "{\"contract_owner\": \"{upn:contract-owner}\", \"impacted_entities\": [\"{entity:enx-a}\"], \"service_description\": \"Payroll SaaS\", \"risk_controls_resume\": \"...\", \"exposure\": {\"internal\": [], \"external\": []}, \"inherent_score\": 7.1, \"residual_score\": 4.6, \"actions\": [{\"owner\": \"{upn:contract-owner}\", \"action\": \"Confirm MFA\"}], \"status\": \"DRAFT awaiting approval\"}",
      "fixture_verdict": "PASS",
      "tags": ["pipeline", "pptx", "reasoning", "cmdb"],
      "added": "2026-09-01",
      "author": "{upn:francisco.gomes}"
    },
    {
      "id": "d2-tpa-evidence-tree",
      "title": "TPA Active evidence tree analysis (synthetic folder)",
      "requirement": "d2",
      "kind": "report",
      "pipeline": "tpa-evidence-analysis",
      "agent": "tpa-evidence-analyzer",
      "tier_of_record": "reasoning",
      "input": {